Tema,Votos,Respuestas,Vistas
Obtener datos en movimiento de <input type=“range”>, 0 votos ,0 respuestas, 20 vistas 
HTML | Subir y mostrar Lista de reproduccion aleatoria, 0 votos , 1 respuesta , 20 vistas 
AngularJS | Como colocar meta tags diferentes en un sitio dinamico con NgRoute?, 0 votos ,0 respuestas, 16 vistas 
vaciar los registro de una tabla mysql con event_scheduler 24h, 4 votos ,0 respuestas, 39 vistas 
Problema al abrir txt alojado en servidor, 1 voto , 1 respuesta , 47 vistas 
autocliclear el boton Start your 30-day free trial de amazon.com, 0 votos , 1 respuesta , 28 vistas 
quitar cuadro azul al hacer clic en icono o imagen tipo boton, -1 votos , 1 respuesta , 22 vistas 
El elemento body obedece al elemento div, 0 votos , 2 respuestas , 35 vistas 
Como logro hacer que mi boton no pierda funcionalidad despues de agregarlo con append en jquery, 1 voto ,0 respuestas, 23 vistas 
Imagenes superpuestas responsives ¿Posibilidades?, 2 votos ,0 respuestas, 18 vistas 
Como hacer transparente la seleccion de un boton en html, 0 votos , 1 respuesta , 20 vistas 
¿Cómo habilitar una página una vez se ejecute todo el código javascript?, 0 votos ,0 respuestas, 40 vistas 
Selenium Java - Esperar a que un elemento esté presente y realizar una acción, 0 votos , 1 respuesta , 395 vistas 
"Mostrar todos los mensajes en un filtro de checkboxes HTML, JavaScript", 0 votos ,0 respuestas, 19 vistas 
